mp_code,mp_formal_name,ntp_code,ntp_formal_name,tm_code,tm_formal_name
02231594,HYGENIPAK INSTAFOAM ANTI-MICROBIAL FOAMING SKIN CLEANSER (triclosan 0.32 % cutaneous liquid) DEB CANADA INC.,9003037,triclosan 0.32 % cutaneous liquid,8001976,triclosan
02217937,HYGENIPAK PLUS ANTI-MICROBIAL SKIN CLEANSER (triclosan 0.32 % cutaneous liquid) DEB CANADA INC.,9003037,triclosan 0.32 % cutaneous liquid,8001976,triclosan
02249340,ANTIBACTERIAL LOTION SOAP (triclosan 0.4 % cutaneous liquid) CHARLOTTE PRODUCTS LIMITED,9004328,triclosan 0.4 % cutaneous liquid,8001976,triclosan
02428695,TRICLOSEPTIC (triclosan 0.5 % cutaneous liquid) JAMP PHARMA CORPORATION,9001709,triclosan 0.5 % cutaneous liquid,8001976,triclosan
02248405,VALOUR ANTISEPTIC HAND CLEANSER (triclosan 0.5 % cutaneous liquid) QWATRO CORPORATION,9001709,triclosan 0.5 % cutaneous liquid,8001976,triclosan
02245467,ANTI-BAC FOAM SOAP (triclosan 0.5 % cutaneous liquid) BENTFIELD EUROPE BV,9001709,triclosan 0.5 % cutaneous liquid,8001976,triclosan
02251604,GENTLE FRESH DEFENSE (triclosan 0.5 % cutaneous liquid) STATE INDUSTRIAL PRODUCTS,9001709,triclosan 0.5 % cutaneous liquid,8001976,triclosan
00266507,ADASEPT LIQ 0.5% (triclosan 0.5 % cutaneous liquid) ODAN LABORATORIES LTD,9001709,triclosan 0.5 % cutaneous liquid,8001976,triclosan
02315505,SPRAY ANTIBACTERIAL SOAP (triclosan 0.5 % cutaneous liquid) RUBBERMAID COMMERCIAL PRODUCTS LLC,9001709,triclosan 0.5 % cutaneous liquid,8001976,triclosan
02315513,ENRICHED FOAM ANTIBACTERIAL SOAP (triclosan 0.5 % cutaneous liquid) RUBBERMAID COMMERCIAL PRODUCTS LLC,9001709,triclosan 0.5 % cutaneous liquid,8001976,triclosan
02267373,INO-F ANTIBAC ANTIBACTERIAL HAND SOAP (triclosan 0.5 % cutaneous liquid) GROUPE DISSAN INC.,9001709,triclosan 0.5 % cutaneous liquid,8001976,triclosan
02318733,ANTIBACTERIAL SPRAY HAND SOAP/SAVON ANTIBACTERIEN EN AEROSOL POUR LES MAINS (triclosan 0.5 % cutaneous spray) AVMOR LTD,9003425,triclosan 0.5 % cutaneous spray,8001976,triclosan
02219433,ANTI-BAC - ASP 0.5% (triclosan 0.5 % cutaneous spray) BENTFIELD EUROPE BV,9003425,triclosan 0.5 % cutaneous spray,8001976,triclosan
02417324,SOFT CARE ANTISEPTIC SKIN CLEANSER II (triclosan 0.55 % cutaneous liquid) DIVERSEY INC,9004052,triclosan 0.55 % cutaneous liquid,8001976,triclosan
02247049,SOFT CARE NUTRA-GERM ANTIBACTERIAL LOTION SOAP (triclosan 0.55 % cutaneous liquid) DIVERSEY INC,9004052,triclosan 0.55 % cutaneous liquid,8001976,triclosan
