drug_code,mp_code,mp_formal_name,mp_fr_description,changes
93459,02448866,SOFT CARE DEFEND FOAM (chloroxylenol 1 % cutaneous solution) DIVERSEY INC,SOFT CARE DEFEND FOAM (chloroxylénol 1 % solution pour application cutanée) DIVERSEY INC,ADDED
93526,02449420,SOFT CARE DEFEND (chloroxylenol 1 % cutaneous solution) DIVERSEY INC,SOFT CARE DEFEND (chloroxylénol 1 % solution pour application cutanée) DIVERSEY INC,ADDED
94646,02459272,HAND SANITIZER FOAM (benzalkonium chloride 0.13 % cutaneous solution) EMPACK SPRAYTECH INC,"HAND SANITIZER FOAM (chlorure de benzalkonium 0,13 % solution pour application cutanée) EMPACK SPRAYTECH INC",ADDED
95030,02462540,ALEXANDER'S RASH EASE - SPORT CREAM (white petrolatum 88.7 % and zinc oxide 5 % cutaneous cream) ALTACOMP ENTERPRISES INC,"ALEXANDER'S RASH EASE - SPORT CREAM (pétrolatum blanc 88,7 % et oxyde de zinc 5 % crème cutanée) ALTACOMP ENTERPRISES INC","mp_status_effective_time: ""20210722"" -> ""20240108"""
95080,02462915,HEALING OINTMENT (white petrolatum 46.5 % cutaneous ointment) CERAVE CANADA,"HEALING OINTMENT (pétrolatum blanc 46,5 % pommade cutanée) CERAVE CANADA",ADDED
95295,02464802,DIAL FOAMING ANTIBACTERIAL HAND WASH (benzalkonium chloride 0.13 % cutaneous solution) HENKEL CANADA CORPORATION,"DIAL FOAMING ANTIBACTERIAL HAND WASH (chlorure de benzalkonium 0,13 % solution pour application cutanée) HENKEL CANADA CORPORATION",ADDED
95297,02464829,DIAL ANTIBACTERIAL HAND SOAP (benzalkonium chloride 0.13 % cutaneous solution) HENKEL CANADA CORPORATION,"DIAL ANTIBACTERIAL HAND SOAP (chlorure de benzalkonium 0,13 % solution pour application cutanée) HENKEL CANADA CORPORATION",ADDED
95595,02467585,SODIUM BICARBONATE INJECTION USP (sodium bicarbonate 84 mg per mL solution for injection) OMEGA LABORATORIES LIMITED,SODIUM BICARBONATE INJECTION USP (bicarbonate de sodium 84 mg par mL solution injectable) OMEGA LABORATORIES LIMITED,ADDED
95769,02469049,PHARMA-AMLODIPINE (amlodipine (amlodipine besylate) 10 mg oral tablet) PHARMASCIENCE INC,PHARMA-AMLODIPINE (amlodipine (bésylate d'amlodipine) 10 mg comprimé oral) PHARMASCIENCE INC,DELETED
95780,02469146,JELIDO (lidocaine hydrochloride 20 mg per mL cutaneous gel) PENDOPHARM DIVISION OF PHARMASCIENCE INC,JELIDO (chlorhydrate de lidocaïne 20 mg par mL gel cutané) PENDOPHARM DIVISION OF PHARMASCIENCE INC,ADDED
95787,02469197,DIAL COMPLETE 2 IN 1 MOISTURIZING & ANTIBACTERIAL FOAMING HAND WASH MANUKA HONEY (benzalkonium chloride 0.13 % cutaneous solution) HENKEL CANADA CORPORATION,"DIAL COMPLETE 2 IN 1 MOISTURIZING & ANTIBACTERIAL FOAMING HAND WASH MANUKA HONEY (chlorure de benzalkonium 0,13 % solution pour application cutanée) HENKEL CANADA CORPORATION",ADDED
95788,02469200,DIAL COMPLETE 2 IN 1 MOISTURIZING & ANTIBACTERIAL FOAMING HAND WASH PEARL ESSENCE (benzalkonium chloride 0.13 % cutaneous solution) HENKEL CANADA CORPORATION,"DIAL COMPLETE 2 IN 1 MOISTURIZING & ANTIBACTERIAL FOAMING HAND WASH PEARL ESSENCE (chlorure de benzalkonium 0,13 % solution pour application cutanée) HENKEL CANADA CORPORATION",ADDED
95990,02470837,FINIPIL LAIT 50 (benzethonium chloride 0.2 % cutaneous cream) EQUIBAL LABS INC,"FINIPIL LAIT 50 (chlorure de benzéthonium 0,2 % crème cutanée) EQUIBAL LABS INC",ADDED
95992,02470853,FINIPIL (benzethonium chloride 0.2 % cutaneous cream) EQUIBAL LABS INC,"FINIPIL (chlorure de benzéthonium 0,2 % crème cutanée) EQUIBAL LABS INC",ADDED
96148,02472198,TRANQUIL MEADOWS AB (benzalkonium chloride 0.13 % NA) ZEP MANUFACTURING COMPANY OF CANADA,"TRANQUIL MEADOWS AB (chlorure de benzalkonium 0,13 % NA) ZEP MANUFACTURING COMPANY OF CANADA",ADDED
96151,02472236,FUZION AB FOAMING HAND SOAP (benzalkonium chloride 0.13 % NA) ZEP MANUFACTURING COMPANY OF CANADA,"FUZION AB FOAMING HAND SOAP (chlorure de benzalkonium 0,13 % NA) ZEP MANUFACTURING COMPANY OF CANADA",ADDED
96159,02472287,ACCLAIM AB (benzalkonium chloride 0.13 % lotion) ZEP MANUFACTURING COMPANY OF CANADA,"ACCLAIM AB (chlorure de benzalkonium 0,13 % lotion) ZEP MANUFACTURING COMPANY OF CANADA",ADDED
96203,02472724,ENERGY BERRY BAIES ÉNERGISANTES FOAMING HAND SOAP ANTIBACTERIAL (benzalkonium chloride 0.13 % cutaneous solution) APOLLO HEALTH AND BEAUTY CARE,"ENERGY BERRY BAIES ÉNERGISANTES FOAMING HAND SOAP ANTIBACTERIAL (chlorure de benzalkonium 0,13 % solution pour application cutanée) APOLLO HEALTH AND BEAUTY CARE",ADDED
96208,02472775,SPRING SHOWERS PLUIES PRINTANIÈRES FOAMING HAND SOAP ANTIBACTERIAL (benzalkonium chloride 0.13 % cutaneous solution) APOLLO HEALTH AND BEAUTY CARE,"SPRING SHOWERS PLUIES PRINTANIÈRES FOAMING HAND SOAP ANTIBACTERIAL (chlorure de benzalkonium 0,13 % solution pour application cutanée) APOLLO HEALTH AND BEAUTY CARE",ADDED
96289,02473496,APO-TELMISARTAN-AMLODIPINE (amlodipine (amlodipine besylate) 10 mg and telmisartan 80 mg oral tablet) APOTEX INC,APO-TELMISARTAN-AMLODIPINE (amlodipine (bésylate d'amlodipine) 10 mg et telmisartan 80 mg comprimé oral) APOTEX INC,DELETED
96343,02473798,PEAR AB HAND SOAP (benzalkonium chloride 0.13 % cutaneous solution) ZEP MANUFACTURING COMPANY OF CANADA,"PEAR AB HAND SOAP (chlorure de benzalkonium 0,13 % solution pour application cutanée) ZEP MANUFACTURING COMPANY OF CANADA",ADDED
96772,02476932,MINT-CANDESARTAN (candesartan cilexetil 32 mg oral tablet) MINT PHARMACEUTICALS INC,MINT-CANDESARTAN (candésartan cilexétil 32 mg comprimé oral) MINT PHARMACEUTICALS INC,ADDED
97020,02479532,MINT-ATORVASTATIN (atorvastatin (atorvastatin calcium) 80 mg oral tablet) MINT PHARMACEUTICALS INC,MINT-ATORVASTATIN (atorvastatine (atorvastatine calcique) 80 mg comprimé oral) MINT PHARMACEUTICALS INC,ADDED
97037,02479729,"ALCOHOL FREE FOAMING HAND SANITIZER (benzalkonium chloride 0.13 % cutaneous solution) VI-JON, LLC","ALCOHOL FREE FOAMING HAND SANITIZER (chlorure de benzalkonium 0,13 % solution pour application cutanée) VI-JON, LLC",ADDED
97058,02480034,POTASSIUM CHLORIDE FOR INJECTION CONCENTRATE (potassium chloride 200 meq per 100 mL solution for injection) OMEGA LABORATORIES LIMITED,POTASSIUM CHLORIDE FOR INJECTION CONCENTRATE (chlorure de potassium 200 meq par 100 mL solution injectable) OMEGA LABORATORIES LIMITED,ADDED
97065,02480131,COVERGIRL TRUBLEND BASE BUSINESS SKIN PRIMER BASE POUR LA PEAU (ensulizole 3 % cutaneous emulsion) HFC PRESTIGE INTERNATIONAL CANADA INC,COVERGIRL TRUBLEND BASE BUSINESS SKIN PRIMER BASE POUR LA PEAU (ensulizole 3 % émulsion cutanée) HFC PRESTIGE INTERNATIONAL CANADA INC,ADDED
97086,02480336,"DYE FREE FRAGRANCE FREE ANTIBACTERIAL FOAMING HAND SOAP (benzalkonium chloride 0.13 % cutaneous solution) VI-JON, LLC","DYE FREE FRAGRANCE FREE ANTIBACTERIAL FOAMING HAND SOAP (chlorure de benzalkonium 0,13 % solution pour application cutanée) VI-JON, LLC",ADDED
97091,02480387,TRISENOX (arsenic trioxide 12 mg per 6 mL solution for injection vial) TEVA CANADA LIMITED,TRISENOX (trioxyde d'arsénic 12 mg par 6 mL solution injectable fiole) TEVA CANADA LIMITED,DELETED
97106,02480506,APPLAUD AB ANTISEPTIC LOTIONIZED HAND SOAP (chloroxylenol 0.5 % NA) ZEP MANUFACTURING COMPANY OF CANADA,"APPLAUD AB ANTISEPTIC LOTIONIZED HAND SOAP (chloroxylénol 0,5 % NA) ZEP MANUFACTURING COMPANY OF CANADA",ADDED
97147,02480816,SCOTT ANTIMICROBIAL FOAM SKIN CLEANSER (benzalkonium chloride 0.1 % cutaneous solution) KIMBERLY-CLARK GLOBAL SALES LLC,"SCOTT ANTIMICROBIAL FOAM SKIN CLEANSER (chlorure de benzalkonium 0,1 % solution pour application cutanée) KIMBERLY-CLARK GLOBAL SALES LLC",ADDED
97189,02481456,SCOTT FOAM HAND SANITIZER (benzalkonium chloride 0.13 % cutaneous solution) KIMBERLY-CLARK GLOBAL SALES LLC,"SCOTT FOAM HAND SANITIZER (chlorure de benzalkonium 0,13 % solution pour application cutanée) KIMBERLY-CLARK GLOBAL SALES LLC",ADDED
97192,02481480,FINIPIL 4 MEN ONLY (benzethonium chloride 0.2 % cutaneous cream) EQUIBAL LABS INC,"FINIPIL 4 MEN ONLY (chlorure de benzéthonium 0,2 % crème cutanée) EQUIBAL LABS INC",ADDED
97592,02485699,POTASSIUM CHLORIDE FOR INJECTION CONCENTRATE USP (potassium chloride 149 mg per mL solution for injection) B. BRAUN MEDICAL INC,POTASSIUM CHLORIDE FOR INJECTION CONCENTRATE USP (chlorure de potassium 149 mg par mL solution injectable) B. BRAUN MEDICAL INC,ADDED
97625,02486024,VIZIMPRO (dacomitinib (dacomitinib monohydrate) 15 mg oral tablet) PFIZER CANADA ULC,VIZIMPRO (dacomitinib (monohydrate de dacomitinib) 15 mg comprimé oral) PFIZER CANADA ULC,DELETED
97664,02486431,ADVANTAGE SANITIZING WIPES (benzalkonium chloride 0.12 % wipe) 2XL CORPORATION,"ADVANTAGE SANITIZING WIPES (chlorure de benzalkonium 0,12 % lingette) 2XL CORPORATION",ADDED
97680,02486628,"SODIUM BICARBONATE INJECTION, USP (sodium bicarbonate 42 mg per mL solution for injection) FRESENIUS KABI CANADA LTD","SODIUM BICARBONATE INJECTION, USP (bicarbonate de sodium 42 mg par mL solution injectable) FRESENIUS KABI CANADA LTD",ADDED
97681,02486636,"SODIUM BICARBONATE INJECTION, USP (sodium bicarbonate 84 mg per mL solution for injection) FRESENIUS KABI CANADA LTD","SODIUM BICARBONATE INJECTION, USP (bicarbonate de sodium 84 mg par mL solution injectable) FRESENIUS KABI CANADA LTD",ADDED
97789,02487756,BIBAG (sodium bicarbonate 900 g per bag powder for concentrate for solution for haemodialysis) FRESENIUS MEDICAL CARE CANADA INC,BIBAG (bicarbonate de sodium 900 g par sac poudre pour solution à diluer pour solution pour hémodialyse) FRESENIUS MEDICAL CARE CANADA INC,ADDED
98062,02490587,NRA-DUTASTERIDE (dutasteride 0.5 mg oral capsule) NORA PHARMA INC,"NRA-DUTASTERIDE (dutastéride 0,5 mg capsule orale) NORA PHARMA INC","Health_Canada_product_name: ""PRIVA-DUTASTERIDE"" -> ""NRA-DUTASTERIDE""
mp_formal_name: ""P̲R̲I̲V̲A-DUTASTERIDE (dutasteride 0.5 mg oral capsule) NORA PHARMA INC"" -> ""N̲R̲A-DUTASTERIDE (dutasteride 0.5 mg oral capsule) NORA PHARMA INC""
mp_fr_description: ""P̲R̲I̲V̲A-DUTASTERIDE (dutastéride 0,5 mg capsule orale) NORA PHARMA INC"" -> ""N̲R̲A-DUTASTERIDE (dutastéride 0,5 mg capsule orale) NORA PHARMA INC"""
98300,02493020,TARO-DOXORUBICIN LIPOSOMAL (doxorubicin hydrochloride 2 mg per mL suspension for injection) TARO PHARMACEUTICALS INC,TARO-DOXORUBICIN LIPOSOMAL (chlorhydrate de doxorubicine 2 mg par mL suspension injectable) TARO PHARMACEUTICALS INC,ADDED
98597,02496097,"PACLITAXEL POWDER FOR INJECTABLE SUSPENSION NANOPARTICLE, ALBUMIN-BOUND PACLITAXEL (paclitaxel 100 mg per vial powder for suspension for injection) PANACEA BIOTEC PHARMA LIMITED","PACLITAXEL POWDER FOR INJECTABLE SUSPENSION NANOPARTICLE, ALBUMIN-BOUND PACLITAXEL (paclitaxel 100 mg par fiole poudre pour suspension injectable) PANACEA BIOTEC PHARMA LIMITED",ADDED
98901,02499274,EZ PUR HAND SANITIZER (benzalkonium chloride 0.15 % cutaneous solution) PRELAM ENTERPRISES LIMITED,"EZ PUR HAND SANITIZER (chlorure de benzalkonium 0,15 % solution pour application cutanée) PRELAM ENTERPRISES LIMITED",ADDED
98983,02500124,FOAM-CARE ULTRA (benzalkonium chloride 0.13 % cutaneous solution) LES CHIMIQUES B.O.D. INC,"FOAM-CARE ULTRA (chlorure de benzalkonium 0,13 % solution pour application cutanée) LES CHIMIQUES B.O.D. INC",ADDED
99098,02501368,DOVE CARE & PROTECT HAND WASH ANTIBACTERIAL (benzalkonium chloride 0.13 % cutaneous solution) UNILEVER CANADA,"DOVE CARE & PROTECT HAND WASH ANTIBACTERIAL (chlorure de benzalkonium 0,13 % solution pour application cutanée) UNILEVER CANADA",ADDED
99175,02502178,ANTI-MICROBE M (benzalkonium chloride 0.15 % cutaneous solution) ATOMS F.D. INC,"ANTI-MICROBE M (chlorure de benzalkonium 0,15 % solution pour application cutanée) ATOMS F.D. INC",ADDED
99178,02502208,HAND SANITIZER (benzalkonium chloride 0.15 % cutaneous solution) CONTRACT PACKAGING DISTRIBUTION INC.,"HAND SANITIZER (chlorure de benzalkonium 0,15 % solution pour application cutanée) CONTRACT PACKAGING DISTRIBUTION INC.",ADDED
99184,02502267,TRIPLE RAIN HAND SANITIZER (benzalkonium chloride 0.125 % cutaneous spray) KIKSTICK SAFETY LTD,"TRIPLE RAIN HAND SANITIZER (chlorure de benzalkonium 0,125 % vaporisation cutanée) KIKSTICK SAFETY LTD",ADDED
99238,02502852,FS ANTIMICROBIAL HAND WASH (benzalkonium chloride 0.13 % cutaneous solution) ZEP MANUFACTURING COMPANY OF CANADA,"FS ANTIMICROBIAL HAND WASH (chlorure de benzalkonium 0,13 % solution pour application cutanée) ZEP MANUFACTURING COMPANY OF CANADA",ADDED
99564,02506300,DERMA SOLUTIONS (benzalkonium chloride 0.15 % cutaneous solution) LAROSE & FILS LTEE,"DERMA SOLUTIONS (chlorure de benzalkonium 0,15 % solution pour application cutanée) LAROSE & FILS LTEE",ADDED
99574,02506351,PURE-T (benzalkonium chloride 0.15 % cutaneous solution) GESTIONS AGRI-MART INC,"PURE-T (chlorure de benzalkonium 0,15 % solution pour application cutanée) GESTIONS AGRI-MART INC",ADDED
99755,02508168,SOFTSOAP ANTIBACTERIAL WHITE TEA & BERRY (benzalkonium chloride 0.13 % cutaneous solution) COLGATE-PALMOLIVE CANADA INC,"SOFTSOAP ANTIBACTERIAL WHITE TEA & BERRY (chlorure de benzalkonium 0,13 % solution pour application cutanée) COLGATE-PALMOLIVE CANADA INC",ADDED
99761,02508222,REFRESH ANTIBAC FOAM (benzalkonium chloride 0.13 % cutaneous solution) SC JOHNSON PROFESSIONAL CA INC,"REFRESH ANTIBAC FOAM (chlorure de benzalkonium 0,13 % solution pour application cutanée) SC JOHNSON PROFESSIONAL CA INC",ADDED
99772,02508354,UPMAID ANTIBACTERIAL HAND SOAP (benzalkonium chloride 0.15 % cutaneous solution) UPMAID TECHNOLOGIES INC.,"UPMAID ANTIBACTERIAL HAND SOAP (chlorure de benzalkonium 0,15 % solution pour application cutanée) UPMAID TECHNOLOGIES INC.",ADDED
99927,02510014,SPIKEVAX (elasomeran 0.2 mg per mL dispersion for injection 5 mL vial) MODERNA BIOPHARMA CANADA CORPORATION,"SPIKEVAX (élasoméran 0,2 mg par mL dispersion injectable 5 mL fiole) MODERNA BIOPHARMA CANADA CORPORATION","mp_status: ""ACTIVE"" -> ""INACTIVE""
mp_status_effective_time: ""20201223"" -> ""20240119"""
99985,02510650,GERMS BE GONE ANTIBACTERIAL HAND SOAP (benzalkonium chloride 0.13 % cutaneous solution) BRANDS INTERNATIONAL CORPORATION,"GERMS BE GONE ANTIBACTERIAL HAND SOAP (chlorure de benzalkonium 0,13 % solution pour application cutanée) BRANDS INTERNATIONAL CORPORATION",ADDED
100018,02510901,SOAPOPULAR ANTIBACTERIAL HAND SOAP (benzalkonium chloride 0.15 % cutaneous solution) SOAPOPULAR INC,"SOAPOPULAR ANTIBACTERIAL HAND SOAP (chlorure de benzalkonium 0,15 % solution pour application cutanée) SOAPOPULAR INC",ADDED
100063,02511436,ENVIRO FRESH HAND SANITIZER (benzalkonium chloride 0.15 % cutaneous solution) ENVIRO FRESH,"ENVIRO FRESH HAND SANITIZER (chlorure de benzalkonium 0,15 % solution pour application cutanée) ENVIRO FRESH",ADDED
100074,02511568,TEVA-NALOXONE NASAL SPRAY (naloxone hydrochloride 4 mg per 0.1 mL nasal spray) TEVA CANADA LIMITED,"TEVA-NALOXONE NASAL SPRAY (chlorhydrate de naloxone 4 mg par 0,1 mL vaporisation nasale) TEVA CANADA LIMITED",ADDED
100161,02512319,VISION ANTIBACTERIAL HAND SOAP (chloroxylenol 0.5 % cutaneous solution) LAWRASON'S INC,"VISION ANTIBACTERIAL HAND SOAP (chloroxylénol 0,5 % solution pour application cutanée) LAWRASON'S INC",ADDED
100228,02513048,ALL CLEAN ANTIBACTERIAL FOAMING HAND WASH (benzalkonium chloride 0.13 % cutaneous solution) ALL CLEAN NATURAL LTD.,"ALL CLEAN ANTIBACTERIAL FOAMING HAND WASH (chlorure de benzalkonium 0,13 % solution pour application cutanée) ALL CLEAN NATURAL LTD.",ADDED
100244,02513226,SANI HANDS FOAM (benzalkonium chloride 0.1 % cutaneous solution) OSTREM CHEMICAL CO LTD.,"SANI HANDS FOAM (chlorure de benzalkonium 0,1 % solution pour application cutanée) OSTREM CHEMICAL CO LTD.",ADDED
100339,02514222,VISTASEAL (fibrinogen human 80 mg per 1 mL and thrombin human 500 unit per 1 mL cutaneous solution) INSTITUTO GRIFOLS S.A.,VISTASEAL (fibrinogène humaine 80 mg par 1 mL et thrombine humaine 500 unité par 1 mL solution pour application cutanée) INSTITUTO GRIFOLS S.A.,ADDED
100340,02514230,VISTASEAL (fibrinogen human 160 mg per 2 mL and thrombin human 1000 unit per 2 mL cutaneous solution) INSTITUTO GRIFOLS S.A.,VISTASEAL (fibrinogène humaine 160 mg par 2 mL et thrombine humaine 1000 unité par 2 mL solution pour application cutanée) INSTITUTO GRIFOLS S.A.,ADDED
100342,02514257,VISTASEAL (fibrinogen human 400 mg per 5 mL and thrombin human 2500 unit per 5 mL cutaneous solution) INSTITUTO GRIFOLS S.A.,VISTASEAL (fibrinogène humaine 400 mg par 5 mL et thrombine humaine 2500 unité par 5 mL solution pour application cutanée) INSTITUTO GRIFOLS S.A.,ADDED
100412,02514729,ANTIBACTERIAL FOAMING SKIN CLEANSER (benzalkonium chloride 0.1 % cutaneous solution) DOLLARAMA L.P.,"ANTIBACTERIAL FOAMING SKIN CLEANSER (chlorure de benzalkonium 0,1 % solution pour application cutanée) DOLLARAMA L.P.",ADDED
100489,02515490,VYXEOS (cytarabine 100 mg and daunorubicin 44 mg powder for solution for injection) JAZZ PHARMACEUTICALS IRELAND LIMITED,VYXEOS (cytarabine 100 mg et daunorubicine 44 mg poudre pour solution injectable) JAZZ PHARMACEUTICALS IRELAND LIMITED,ADDED
100560,02516225,SODIUM BICARBONATE INJECTION USP (sodium bicarbonate 84 mg per mL solution for injection) JAMP PHARMA CORPORATION,SODIUM BICARBONATE INJECTION USP (bicarbonate de sodium 84 mg par mL solution injectable) JAMP PHARMA CORPORATION,ADDED
101023,02520990,"NYPOZI (filgrastim 300 mcg per 0.5 mL solution for injection) TANVEX BIOPHARMA USA, INC.","NYPOZI (filgrastim 300 mcg par 0,5 mL solution injectable) TANVEX BIOPHARMA USA, INC.",ADDED
101024,02521008,"NYPOZI (filgrastim 480 mcg per 0.8 mL solution for injection) TANVEX BIOPHARMA USA, INC.","NYPOZI (filgrastim 480 mcg par 0,8 mL solution injectable) TANVEX BIOPHARMA USA, INC.",ADDED
101099,02521806,NRA-CETIRIZINE (cetirizine hydrochloride 20 mg oral tablet) NORA PHARMA INC,NRA-CETIRIZINE (chlorhydrate de cétirizine 20 mg comprimé oral) NORA PHARMA INC,DELETED
101155,02522438,GLASSIA (alpha1-proteinase inhibitor human 1000 mg per 50 mL solution for injection vial) TAKEDA CANADA INC,GLASSIA (inhibiteur de l'alpha1-protéinase humain 1000 mg par 50 mL solution injectable fiole) TAKEDA CANADA INC,ADDED
101242,02523310,KETOROLAC TROMETHAMINE INJECTION USP (ketorolac tromethamine 30 mg per mL solution for injection) JAMP PHARMA CORPORATION,KETOROLAC TROMETHAMINE INJECTION USP (trométhamine de kétorolac 30 mg par mL solution injectable) JAMP PHARMA CORPORATION,ADDED
101673,02527685,SPIKEVAX (elasomeran 0.1 mg per mL dispersion for injection 2.5 mL vial) MODERNA BIOPHARMA CANADA CORPORATION,"SPIKEVAX (élasoméran 0,1 mg par mL dispersion injectable 2,5 mL fiole) MODERNA BIOPHARMA CANADA CORPORATION",DELETED
101744,02528193,MAGNESIUM CHLORIDE FOR HEMODIALYSIS 5.15 (magnesium chloride (magnesium chloride hexahydrate) 5.15 g per vial powder for concentrate for solution for haemodialysis) CHIEF MEDICAL SUPPLIES LTD,"MAGNESIUM CHLORIDE FOR HEMODIALYSIS 5.15 (chlorure de magnésium 5,15 g par fiole poudre pour solution à diluer pour solution pour hémodialyse) CHIEF MEDICAL SUPPLIES LTD",ADDED
101903,02529793,POTASSIUM CHLORIDE FOR HEMODIALYSIS 7.55 (potassium chloride 7.55 g per vial powder for concentrate for solution for haemodialysis) CHIEF MEDICAL SUPPLIES LTD,"POTASSIUM CHLORIDE FOR HEMODIALYSIS 7.55 (chlorure de potassium 7,55 g par fiole poudre pour solution à diluer pour solution pour hémodialyse) CHIEF MEDICAL SUPPLIES LTD",ADDED
101943,02530252,SPIKEVAX BIVALENT (elasomeran 0.05 mg per mL and imelasomeran 0.05 mg per mL dispersion for injection 2.5 mL vial) MODERNA BIOPHARMA CANADA CORPORATION,"SPIKEVAX BIVALENT (élasoméran 0,05 mg par mL et imélasoméran 0,05 mg par mL dispersion injectable 2,5 mL fiole) MODERNA BIOPHARMA CANADA CORPORATION",DELETED
102111,02532042,PRZ-AMOXICILLIN (amoxicillin (amoxicillin trihydrate) 250 mg oral capsule) PHARMARIS CANADA INC,PRZ-AMOXICILLIN (amoxicilline (trihydrate d'amoxicilline) 250 mg capsule orale) PHARMARIS CANADA INC,ADDED
102112,02532050,PRZ-AMOXICILLIN (amoxicillin (amoxicillin trihydrate) 500 mg oral capsule) PHARMARIS CANADA INC,PRZ-AMOXICILLIN (amoxicilline (trihydrate d'amoxicilline) 500 mg capsule orale) PHARMARIS CANADA INC,ADDED
102139,02532352,SPIKEVAX BIVALENT (ORIGINAL / OMICRON BA.4/5) (davesomeran 0.05 mg per mL and elasomeran 0.05 mg per mL dispersion for injection 2.5 mL vial) MODERNA BIOPHARMA CANADA CORPORATION,"SPIKEVAX BIVALENT (ORIGINAL / OMICRON BA.4/5) (davésoméran 0,05 mg par mL et élasoméran 0,05 mg par mL dispersion injectable 2,5 mL fiole) MODERNA BIOPHARMA CANADA CORPORATION",DELETED
102141,02532379,GLYCOPYRROLATE INJECTION USP (glycopyrrolate 4 mg per 20 mL solution for injection vial) JAMP PHARMA CORPORATION,GLYCOPYRROLATE INJECTION USP (glycopyrrolate 4 mg par 20 mL solution injectable fiole) JAMP PHARMA CORPORATION,ADDED
102374,02534843,PRO-NIFEDIPINE ER (nifedipine 30 mg prolonged-release oral tablet) PRO DOC LIMITEE,PRO-NIFEDIPINE ER (nifédipine 30 mg comprimé oral à libération prolongée) PRO DOC LIMITEE,ADDED
102432,02535475,FROVATRIPTAN (frovatriptan (frovatriptan succinate) 2.5 mg oral tablet) SANIS HEALTH INC,"FROVATRIPTAN (frovatriptan (succinate de frovatriptan) 2,5 mg comprimé oral) SANIS HEALTH INC",ADDED
102445,02535610,REDDY-SAPROPTERIN (sapropterin dihydrochloride 500 mg per sachet powder for oral solution) DR REDDY'S LABORATORIES LTD,REDDY-SAPROPTERIN (dichlorhydrate de saproptérine 500 mg par sachet poudre pour solution orale) DR REDDY'S LABORATORIES LTD,ADDED
102456,02535734,ACETAMINOPHEN INJECTION (acetaminophen 100 mg per 10 mL solution for injection ampoule) B. BRAUN MELSUNGEN AG,ACETAMINOPHEN INJECTION (acétaminophène 100 mg par 10 mL solution injectable ampoule) B. BRAUN MELSUNGEN AG,ADDED
102457,02535742,ACETAMINOPHEN INJECTION (acetaminophen 500 mg per 50 mL solution for injection bottle) B. BRAUN MELSUNGEN AG,ACETAMINOPHEN INJECTION (acétaminophène 500 mg par 50 mL solution injectable bouteille) B. BRAUN MELSUNGEN AG,ADDED
102517,02536390,DEXLANSOPRAZOLE (dexlansoprazole 30 mg gastro-resistant capsule) ALTIUS HEALTHCARE INC,DEXLANSOPRAZOLE (dexlansoprazole 30 mg capsule gastrorésistante) ALTIUS HEALTHCARE INC,ADDED
102518,02536404,DEXLANSOPRAZOLE (dexlansoprazole 60 mg gastro-resistant capsule) ALTIUS HEALTHCARE INC,DEXLANSOPRAZOLE (dexlansoprazole 60 mg capsule gastrorésistante) ALTIUS HEALTHCARE INC,ADDED
102558,02536854,MINT-MEXILETINE (mexiletine hydrochloride 200 mg oral capsule) MINT PHARMACEUTICALS INC,MINT-MEXILETINE (chlorhydrate de mexilétine 200 mg capsule orale) MINT PHARMACEUTICALS INC,ADDED
102686,02538113,ANTIBACTERIAL HAND WIPES (benzalkonium chloride 0.13 % wipe) CANADIAN CUSTOM PACKAGING COMPANY,"ANTIBACTERIAL HAND WIPES (chlorure de benzalkonium 0,13 % lingette) CANADIAN CUSTOM PACKAGING COMPANY",ADDED
102695,02538202,MINT-TRIMEBUTINE (trimebutine maleate 100 mg oral tablet) MINT PHARMACEUTICALS INC,MINT-TRIMEBUTINE (maléate de trimébutine 100 mg comprimé oral) MINT PHARMACEUTICALS INC,ADDED
102696,02538210,MINT-TRIMEBUTINE (trimebutine maleate 200 mg oral tablet) MINT PHARMACEUTICALS INC,MINT-TRIMEBUTINE (maléate de trimébutine 200 mg comprimé oral) MINT PHARMACEUTICALS INC,ADDED
102778,02539136,NAT-ERIBULIN (eribulin mesylate 1 mg per 2 mL solution for injection vial) NATCO PHARMA (CANADA) INC,NAT-ERIBULIN (mésylate d'éribuline 1 mg par 2 mL solution injectable fiole) NATCO PHARMA (CANADA) INC,ADDED
102820,02539454,PLERIXAFOR INJECTION (plerixafor 24 mg per 1.2 mL solution for injection vial) EUGIA PHARMA INC.,"PLERIXAFOR INJECTION (plérixafor 24 mg par 1,2 mL solution injectable fiole) EUGIA PHARMA INC.",ADDED
102895,02540258,OZEMPIC (semaglutide 0.68 mg per mL solution for injection 3 mL pen) NOVO NORDISK CANADA INC,"OZEMPIC (sémaglutide 0,68 mg par mL solution injectable 3 mL stylo) NOVO NORDISK CANADA INC",ADDED
102963,02540924,PRO-DILTIAZEM CD (diltiazem hydrochloride 120 mg prolonged-release oral capsule) PRO DOC LIMITEE,PRO-DILTIAZEM CD (chlorhydrate de diltiazem 120 mg capsule orale à libération prolongée) PRO DOC LIMITEE,ADDED
102964,02540932,PRO-DILTIAZEM CD (diltiazem hydrochloride 180 mg prolonged-release oral capsule) PRO DOC LIMITEE,PRO-DILTIAZEM CD (chlorhydrate de diltiazem 180 mg capsule orale à libération prolongée) PRO DOC LIMITEE,ADDED
102965,02540940,PRO-DILTIAZEM CD (diltiazem hydrochloride 240 mg prolonged-release oral capsule) PRO DOC LIMITEE,PRO-DILTIAZEM CD (chlorhydrate de diltiazem 240 mg capsule orale à libération prolongée) PRO DOC LIMITEE,ADDED
102966,02540959,PRO-DILTIAZEM CD (diltiazem hydrochloride 300 mg prolonged-release oral capsule) PRO DOC LIMITEE,PRO-DILTIAZEM CD (chlorhydrate de diltiazem 300 mg capsule orale à libération prolongée) PRO DOC LIMITEE,ADDED
103020,02541564,ATENOLOL (atenolol 25 mg oral tablet) SIVEM PHARMACEUTICALS ULC,ATENOLOL (aténolol 25 mg comprimé oral) SIVEM PHARMACEUTICALS ULC,ADDED
103073,02542137,ORGOVYX (relugolix 120 mg oral tablet) SUMITOMO PHARMA SWITZERLAND GMBH,ORGOVYX (rélugolix 120 mg comprimé oral) SUMITOMO PHARMA SWITZERLAND GMBH,ADDED
103087,02542293,EPKINLY (epcoritamab 4 mg per 0.8 mL solution for injection vial) ABBVIE CORPORATION,"EPKINLY (épcoritamab 4 mg par 0,8 mL solution injectable fiole) ABBVIE CORPORATION",ADDED
103088,02542307,EPKINLY (epcoritamab 48 mg per 0.8 mL solution for injection vial) ABBVIE CORPORATION,"EPKINLY (épcoritamab 48 mg par 0,8 mL solution injectable fiole) ABBVIE CORPORATION",ADDED
103100,02542420,AMVUTTRA (vutrisiran (vutrisiran sodium) 25 mg per 0.5 mL solution for injection syringe) ALNYLAM NETHERLANDS B.V.,"AMVUTTRA (vutrisiran (vutrisiran sodique) 25 mg par 0,5 mL solution injectable seringue) ALNYLAM NETHERLANDS B.V.",ADDED
103124,02542706,DOPTELET (avatrombopag (avatrombopag maleate) 20 mg oral tablet) SWEDISH ORPHAN BIOVITRUM AB (PUBL),DOPTELET (avatrombopag (maléate d'avatrombopag) 20 mg comprimé oral) SWEDISH ORPHAN BIOVITRUM AB (PUBL),ADDED
103143,02542900,REPAIR & PROTECT (petrolatum 45 % cutaneous stick) BLISTEX CORPORATION,REPAIR & PROTECT (pétrolatum 45 % bâton pour application cutanée) BLISTEX CORPORATION,ADDED
